{
  "schema_version": "1.1.0",
  "interface": "TE-IFACE-CONTENT@1.1.0",
  "base_commit": "a1bf6689b9ba6a3c7077869ee03be1926b2e1c41",
  "interface_sha256": "7d682d883fc55b80ed3c5ea752ea942d94000942257dd93a3eddc22a66c36903",
  "content_sha256": "540623c9e7f973f0f1cfa4bd4aa5b27f5150247004a05b61ab3a8791b87e0a2e",
  "mappings": [
    {
      "surface": "accessibility.focus",
      "copy_keys": [
        "lane_a.accessibility.focus"
      ],
      "status": "MAPPED_ADDITIVE_CANDIDATE"
    },
    {
      "surface": "accessibility.high_contrast",
      "copy_keys": [
        "lane_a.accessibility.high_contrast"
      ],
      "status": "MAPPED_ADDITIVE_CANDIDATE"
    },
    {
      "surface": "accessibility.instant_text",
      "copy_keys": [
        "lane_a.accessibility.instant_text"
      ],
      "status": "MAPPED_ADDITIVE_CANDIDATE"
    },
    {
      "surface": "accessibility.plain_list",
      "copy_keys": [
        "lane_a.accessibility.plain_list"
      ],
      "status": "MAPPED_ADDITIVE_CANDIDATE"
    },
    {
      "surface": "accessibility.player_paced",
      "copy_keys": [
        "lane_a.accessibility.player_paced"
      ],
      "status": "MAPPED_ADDITIVE_CANDIDATE"
    },
    {
      "surface": "accessibility.reduced_motion",
      "copy_keys": [
        "lane_a.accessibility.reduced_motion"
      ],
      "status": "MAPPED_ADDITIVE_CANDIDATE"
    },
    {
      "surface": "alternate.CLOSE:record-canister",
      "copy_keys": [
        "lane_a.dead.alternate.8"
      ],
      "status": "MAPPED_ADDITIVE_CANDIDATE"
    },
    {
      "surface": "alternate.OPEN:pneumatic-tube",
      "copy_keys": [
        "lane_a.dead.alternate.6"
      ],
      "status": "MAPPED_ADDITIVE_CANDIDATE"
    },
    {
      "surface": "alternate.OPEN:request-dispenser",
      "copy_keys": [
        "lane_a.dead.alternate.3"
      ],
      "status": "MAPPED_ADDITIVE_CANDIDATE"
    },
    {
      "surface": "alternate.OPEN:rotunda-exit",
      "copy_keys": [
        "lane_a.dead.alternate.10"
      ],
      "status": "MAPPED_ADDITIVE_CANDIDATE"
    },
    {
      "surface": "alternate.PULL:dispatch-plunger",
      "copy_keys": [
        "lane_a.dead.alternate.7"
      ],
      "status": "MAPPED_ADDITIVE_CANDIDATE"
    },
    {
      "surface": "alternate.PULL:historical-clock",
      "copy_keys": [
        "lane_a.dead.alternate.2"
      ],
      "status": "MAPPED_ADDITIVE_CANDIDATE"
    },
    {
      "surface": "alternate.PULL:mr-index",
      "copy_keys": [
        "lane_a.dead.alternate.5"
      ],
      "status": "MAPPED_ADDITIVE_CANDIDATE"
    },
    {
      "surface": "alternate.PULL:pen-stand",
      "copy_keys": [
        "lane_a.dead.alternate.4"
      ],
      "status": "MAPPED_ADDITIVE_CANDIDATE"
    },
    {
      "surface": "alternate.PUSH:filing-drawers",
      "copy_keys": [
        "lane_a.dead.alternate.1"
      ],
      "status": "MAPPED_ADDITIVE_CANDIDATE"
    },
    {
      "surface": "alternate.PUSH:nansen-terminal",
      "copy_keys": [
        "lane_a.dead.alternate.9"
      ],
      "status": "MAPPED_ADDITIVE_CANDIDATE"
    },
    {
      "surface": "banter.archive_ace.arthur",
      "copy_keys": [
        "lane_a.banter.archive_ace.arthur"
      ],
      "status": "MAPPED_ADDITIVE_CANDIDATE"
    },
    {
      "surface": "banter.archive_ace.rook",
      "copy_keys": [
        "lane_a.banter.archive_ace.rook"
      ],
      "status": "MAPPED_ADDITIVE_CANDIDATE"
    },
    {
      "surface": "banter.mr_a.arthur",
      "copy_keys": [
        "lane_a.banter.mr_a.arthur"
      ],
      "status": "MAPPED_ADDITIVE_CANDIDATE"
    },
    {
      "surface": "banter.mr_a.rook",
      "copy_keys": [
        "lane_a.banter.mr_a.rook"
      ],
      "status": "MAPPED_ADDITIVE_CANDIDATE"
    },
    {
      "surface": "candidate.cannot_prove",
      "copy_keys": [
        "lane_a.candidate.cannot_prove"
      ],
      "status": "MAPPED_ADDITIVE_CANDIDATE"
    },
    {
      "surface": "candidate.compare",
      "copy_keys": [
        "lane_a.candidate.compare"
      ],
      "status": "MAPPED_ADDITIVE_CANDIDATE"
    },
    {
      "surface": "candidate.context",
      "copy_keys": [
        "lane_a.candidate.context"
      ],
      "status": "MAPPED_ADDITIVE_CANDIDATE"
    },
    {
      "surface": "candidate.control",
      "copy_keys": [
        "lane_a.candidate.control"
      ],
      "status": "MAPPED_ADDITIVE_CANDIDATE"
    },
    {
      "surface": "candidate.corroboration",
      "copy_keys": [
        "lane_a.candidate.corroboration"
      ],
      "status": "MAPPED_ADDITIVE_CANDIDATE"
    },
    {
      "surface": "candidate.may_support",
      "copy_keys": [
        "lane_a.candidate.may_support"
      ],
      "status": "MAPPED_ADDITIVE_CANDIDATE"
    },
    {
      "surface": "candidate.next_question",
      "copy_keys": [
        "lane_a.candidate.next_question"
      ],
      "status": "MAPPED_ADDITIVE_CANDIDATE"
    },
    {
      "surface": "candidate.pin",
      "copy_keys": [
        "lane_a.candidate.pin"
      ],
      "status": "MAPPED_ADDITIVE_CANDIDATE"
    },
    {
      "surface": "candidate.pinned",
      "copy_keys": [
        "lane_a.candidate.pinned"
      ],
      "status": "MAPPED_ADDITIVE_CANDIDATE"
    },
    {
      "surface": "candidate.repeat",
      "copy_keys": [
        "lane_a.candidate.repeat"
      ],
      "status": "MAPPED_ADDITIVE_CANDIDATE"
    },
    {
      "surface": "candidate.save",
      "copy_keys": [
        "lane_a.candidate.save"
      ],
      "status": "MAPPED_ADDITIVE_CANDIDATE"
    },
    {
      "surface": "candidate.saved",
      "copy_keys": [
        "lane_a.candidate.saved"
      ],
      "status": "MAPPED_ADDITIVE_CANDIDATE"
    },
    {
      "surface": "candidate.source",
      "copy_keys": [
        "lane_a.candidate.source"
      ],
      "status": "MAPPED_ADDITIVE_CANDIDATE"
    },
    {
      "surface": "candidate.why_matched",
      "copy_keys": [
        "lane_a.candidate.why_matched"
      ],
      "status": "MAPPED_ADDITIVE_CANDIDATE"
    },
    {
      "surface": "CARD.ASSET_OUT.cannot_establish",
      "copy_keys": [
        "lane_a.card.asset_out.cannot_establish"
      ],
      "status": "MAPPED_ADDITIVE_CANDIDATE"
    },
    {
      "surface": "CARD.ASSET_OUT.may_establish",
      "copy_keys": [
        "lane_a.card.asset_out.may_establish"
      ],
      "status": "MAPPED_ADDITIVE_CANDIDATE"
    },
    {
      "surface": "CARD.ASSET_OUT.next",
      "copy_keys": [
        "lane_a.card.asset_out.next"
      ],
      "status": "MAPPED_ADDITIVE_CANDIDATE"
    },
    {
      "surface": "CARD.ASSET_OUT.question",
      "copy_keys": [
        "lane_a.card.asset_out.question"
      ],
      "status": "MAPPED_ADDITIVE_CANDIDATE"
    },
    {
      "surface": "CARD.ASSET_OUT.why",
      "copy_keys": [
        "lane_a.card.asset_out.why"
      ],
      "status": "MAPPED_ADDITIVE_CANDIDATE"
    },
    {
      "surface": "CARD.COMPARE_ROUTES.cannot_establish",
      "copy_keys": [
        "lane_a.card.compare_routes.cannot_establish"
      ],
      "status": "MAPPED_ADDITIVE_CANDIDATE"
    },
    {
      "surface": "CARD.COMPARE_ROUTES.may_establish",
      "copy_keys": [
        "lane_a.card.compare_routes.may_establish"
      ],
      "status": "MAPPED_ADDITIVE_CANDIDATE"
    },
    {
      "surface": "CARD.COMPARE_ROUTES.next",
      "copy_keys": [
        "lane_a.card.compare_routes.next"
      ],
      "status": "MAPPED_ADDITIVE_CANDIDATE"
    },
    {
      "surface": "CARD.COMPARE_ROUTES.question",
      "copy_keys": [
        "lane_a.card.compare_routes.question"
      ],
      "status": "MAPPED_ADDITIVE_CANDIDATE"
    },
    {
      "surface": "CARD.COMPARE_ROUTES.why",
      "copy_keys": [
        "lane_a.card.compare_routes.why"
      ],
      "status": "MAPPED_ADDITIVE_CANDIDATE"
    },
    {
      "surface": "CARD.EXACT_RECEIPT.cannot_establish",
      "copy_keys": [
        "lane_a.card.exact_receipt.cannot_establish"
      ],
      "status": "MAPPED_ADDITIVE_CANDIDATE"
    },
    {
      "surface": "CARD.EXACT_RECEIPT.may_establish",
      "copy_keys": [
        "lane_a.card.exact_receipt.may_establish"
      ],
      "status": "MAPPED_ADDITIVE_CANDIDATE"
    },
    {
      "surface": "CARD.EXACT_RECEIPT.next",
      "copy_keys": [
        "lane_a.card.exact_receipt.next"
      ],
      "status": "MAPPED_ADDITIVE_CANDIDATE"
    },
    {
      "surface": "CARD.EXACT_RECEIPT.question",
      "copy_keys": [
        "lane_a.card.exact_receipt.question"
      ],
      "status": "MAPPED_ADDITIVE_CANDIDATE"
    },
    {
      "surface": "CARD.EXACT_RECEIPT.why",
      "copy_keys": [
        "lane_a.card.exact_receipt.why"
      ],
      "status": "MAPPED_ADDITIVE_CANDIDATE"
    },
    {
      "surface": "CARD.FOLLOW_FORWARD.cannot_establish",
      "copy_keys": [
        "lane_a.card.follow_forward.cannot_establish"
      ],
      "status": "MAPPED_ADDITIVE_CANDIDATE"
    },
    {
      "surface": "CARD.FOLLOW_FORWARD.may_establish",
      "copy_keys": [
        "lane_a.card.follow_forward.may_establish"
      ],
      "status": "MAPPED_ADDITIVE_CANDIDATE"
    },
    {
      "surface": "CARD.FOLLOW_FORWARD.next",
      "copy_keys": [
        "lane_a.card.follow_forward.next"
      ],
      "status": "MAPPED_ADDITIVE_CANDIDATE"
    },
    {
      "surface": "CARD.FOLLOW_FORWARD.question",
      "copy_keys": [
        "lane_a.card.follow_forward.question"
      ],
      "status": "MAPPED_ADDITIVE_CANDIDATE"
    },
    {
      "surface": "CARD.FOLLOW_FORWARD.why",
      "copy_keys": [
        "lane_a.card.follow_forward.why"
      ],
      "status": "MAPPED_ADDITIVE_CANDIDATE"
    },
    {
      "surface": "CARD.HIGH_VALUE.cannot_establish",
      "copy_keys": [
        "lane_a.card.high_value.cannot_establish"
      ],
      "status": "MAPPED_ADDITIVE_CANDIDATE"
    },
    {
      "surface": "CARD.HIGH_VALUE.may_establish",
      "copy_keys": [
        "lane_a.card.high_value.may_establish"
      ],